{
  "$schema": "https://json-schema.org/draft/2020-12/schema",
  "$id": "https://raw.githubusercontent.com/kazu728/midilab/main/data/fp30x-address-map.schema.json",
  "title": "roland-sysex-map/v0",
  "description": "A Roland addressed-SysEx (DT1/RQ1) parameter map that carries, per entry, where the entry came from and whether hardware has confirmed it. Written for the FP-30X, but nothing here is FP-30X specific.",
  "type": "object",
  "additionalProperties": false,
  "required": ["schema", "device", "params"],
  "properties": {
    "schema": { "const": "roland-sysex-map/v0" },
    "notice": {
      "type": "string",
      "description": "Affiliation and confidence disclaimer, travelling with the data."
    },
    "device": { "$ref": "#/$defs/device" },
    "params": {
      "type": "array",
      "minItems": 1,
      "items": { "$ref": "#/$defs/param" }
    },
    "examples": {
      "type": "array",
      "description": "Frames quoted from a source, so a validator can re-derive their checksums instead of trusting the quote.",
      "items": { "$ref": "#/$defs/example" }
    }
  },
  "$defs": {
    "hex": {
      "type": "string",
      "description": "7-bit bytes as hex, optionally space separated.",
      "pattern": "^[0-7][0-9A-Fa-f]( ?[0-7][0-9A-Fa-f])*$"
    },
    "address": {
      "type": "string",
      "description": "A four-byte Roland parameter address, every byte 7-bit.",
      "pattern": "^[0-7][0-9A-Fa-f]( ?[0-7][0-9A-Fa-f]){3}$"
    },
    "identity_word": {
      "type": "string",
      "description": "A two-byte Universal Identity family or member code.",
      "pattern": "^[0-7][0-9A-Fa-f] ?[0-7][0-9A-Fa-f]$"
    },
    "frame": {
      "type": "string",
      "description": "A complete F0..F7 frame as hex, optionally space separated. Both ends are required: a frame quoted without its terminator is a fragment, and a validator that accepts fragments is describing a different format than the one tools read.",
      "pattern": "^[Ff]0( ?[0-9A-Fa-f]{2})* ?[Ff]7$"
    },
    "device": {
      "type": "object",
      "additionalProperties": false,
      "required": [
        "name",
        "identity_family",
        "identity_member",
        "model_id",
        "device_id_default",
        "checksum"
      ],
      "properties": {
        "name": { "type": "string" },
        "identity_family": { "$ref": "#/$defs/identity_word" },
        "identity_member": { "$ref": "#/$defs/identity_word" },
        "model_id": { "$ref": "#/$defs/hex" },
        "device_id_default": {
          "type": "string",
          "pattern": "^[0-7][0-9A-Fa-f]$"
        },
        "checksum": {
          "const": "roland7",
          "description": "Roland's one-byte checksum over address plus payload."
        },
        "corroborations": {
          "type": "array",
          "items": { "type": "string" },
          "description": "Independent efforts reporting the same constants. Weaker than a measurement, and kept apart from one."
        }
      }
    },
    "param": {
      "type": "object",
      "additionalProperties": false,
      "required": ["name", "size", "encoding", "source", "source_ref"],
      "anyOf": [
        { "required": ["read_address"] },
        { "required": ["write_address"] }
      ],
      "allOf": [
        {
          "if": { "properties": { "encoding": { "const": "u7" } }, "required": ["encoding"] },
          "then": { "properties": { "size": { "const": 1 } } }
        },
        {
          "if": { "properties": { "encoding": { "const": "u14" } }, "required": ["encoding"] },
          "then": { "properties": { "size": { "const": 2 } } }
        },
        {
          "$comment": "Raw bytes have no single numeric value, so naming or bounding them would describe something that does not exist.",
          "if": { "properties": { "encoding": { "const": "raw" } }, "required": ["encoding"] },
          "then": {
            "properties": {
              "enum": false,
              "range": false
            }
          }
        }
      ],
      "properties": {
        "name": { "type": "string", "pattern": "^[a-z][a-z0-9_]*$" },
        "read_address": { "$ref": "#/$defs/address" },
        "write_address": { "$ref": "#/$defs/address" },
        "size": { "type": "integer", "minimum": 1, "maximum": 16 },
        "encoding": {
          "enum": ["u7", "u14", "raw"],
          "description": "u7: one 7-bit byte. u14: two 7-bit bytes, most significant first. raw: bytes with no single numeric meaning."
        },
        "enum": {
          "type": "object",
          "description": "The whole known value space, when the values have names. Keys are decimal values with no leading zeros, so that every reader parses them the same way.",
          "propertyNames": { "pattern": "^(0|[1-9][0-9]{0,4})$" },
          "additionalProperties": { "type": "string" }
        },
        "range": {
          "type": "object",
          "additionalProperties": false,
          "required": ["min", "max"],
          "properties": {
            "min": { "type": "integer", "minimum": 0 },
            "max": { "type": "integer", "minimum": 0 }
          }
        },
        "verify_with": {
          "type": "string",
          "description": "Parameter to read back after writing this one, when the write address cannot be read."
        },
        "source": {
          "enum": ["official_doc", "app_re", "panel_capture"],
          "description": "official_doc: the manufacturer's published implementation. app_re: reverse engineering of the manufacturer's app. panel_capture: seen on the wire when the panel was used."
        },
        "source_ref": { "type": "string" },
        "corroborations": { "type": "array", "items": { "type": "string" } },
        "verified": {
          "type": "array",
          "description": "Hardware confirmations. Empty means unverified hypothesis.",
          "items": { "$ref": "#/$defs/verification" }
        },
        "notes": { "type": "string" }
      }
    },
    "verification": {
      "type": "object",
      "additionalProperties": false,
      "required": ["firmware", "date", "method"],
      "description": "Scoped to one firmware revision and one unit: a single instrument cannot speak for the model.",
      "properties": {
        "firmware": {
          "type": "string",
          "description": "Software revision from the device's Identity Reply."
        },
        "date": { "type": "string", "pattern": "^[0-9]{4}-[0-9]{2}-[0-9]{2}$" },
        "method": {
          "enum": ["panel_capture", "rq1_roundtrip", "write_readback"]
        }
      }
    },
    "example": {
      "type": "object",
      "additionalProperties": false,
      "required": ["frame", "note"],
      "properties": {
        "frame": { "$ref": "#/$defs/frame" },
        "note": { "type": "string" }
      }
    }
  }
}
